context,question,answer
"We now explain how our typology can be applied to the particular setting of Reddit, and describe the overall behaviour of our linguistic axes in this context..Dataset description. Reddit is a popular website where users form and participate in discussion-based communities called subreddits. Within these communities, users post content—such as images, URLs, or questions—which often spark vibrant lengthy discussions in thread-based comment sections..The website contains many highly active subreddits with thousands of active subscribers. These communities span an extremely rich variety of topical interests, as represented by the examples described earlier. They also vary along a rich multitude of structural dimensions, such as the number of users, the amount of conversation and social interaction, and the social norms determining which types of content become popular. The diversity and scope of Reddit's multicommunity ecosystem make it an ideal landscape in which to closely examine the relation between varying community identities and social dynamics..Our full dataset consists of all subreddits on Reddit from January 2013 to December 2014, for which there are at least 500 words in the vocabulary used to estimate our measures, in at least 4 months of the subreddit's history. We compute our measures over the comments written by users in a community in time windows of months, for each sufficiently active month, and manually remove communities where the bulk of the contributions are in a foreign language. This results in 283 communities ( INLINEFORM0 ), for a total of 4,872 community-months ( INLINEFORM1 )..Estimating linguistic measures. We estimate word frequencies INLINEFORM0 , and by extension each downstream measure, in a carefully controlled manner in order to ensure we capture robust and meaningful linguistic behaviour. First, we only consider top-level comments which are initial responses to a post, as the content of lower-level responses might reflect conventions of dialogue more than a community's high-level interests. Next, in order to prevent a few highly active users from dominating our frequency estimates, we count each unique word once per user, ignoring successive uses of the same word by the same user. This ensures that our word-level characterizations are not skewed by a small subset of highly active contributors..In our subsequent analyses, we will only look at these measures computed over the nouns used in comments. In principle, our framework can be applied to any choice of vocabulary. However, in the case of Reddit using nouns provides a convenient degree of interpretability. We can easily understand the implication of a community preferentially mentioning a noun such as gamer or feminist, but interpreting the overuse of verbs or function words such as take or of is less straightforward. Additionally, in focusing on nouns we adopt the view emphasized in modern “third wave” accounts of sociolinguistic variation, that stylistic variation is inseparable from topical content BIBREF23 . In the case of online communities, the choice of what people choose to talk about serves as a primary signal of social identity. That said, a typology based on more purely stylistic differences is an interesting avenue for future work..Accounting for rare words. One complication when using measures such as PMI, which are based off of ratios of frequencies, is that estimates for very infrequent words could be overemphasized BIBREF24 . Words that only appear a few times in a community tend to score at the extreme ends of our measures (e.g. as highly specific or highly generic), obfuscating the impact of more frequent words in the community. To address this issue, we discard the long tail of infrequent words in our analyses, using only the top 5th percentile of words, by frequency within each INLINEFORM0 , to score comments and communities..Typology output on Reddit. The distribution of INLINEFORM0 and INLINEFORM1 across Reddit communities is shown in Figure FIGREF3 .B, along with examples of communities at the extremes of our typology. We find that interpretable groupings of communities emerge at various points within our axes. For instance, highly distinctive and dynamic communities tend to focus on rapidly-updating interests like sports teams and games, while generic and consistent communities tend to be large “link-sharing” hubs where users generally post content with no clear dominating themes. More examples of communities at the extremes of our typology are shown in Table TABREF9 ..We note that these groupings capture abstract properties of a community's content that go beyond its topic. For instance, our typology relates topically contrasting communities such as yugioh (which is about a popular trading card game) and Seahawks through the shared trait that their content is particularly distinctive. Additionally, the axes can clarify differences between topically similar communities: while startrek and thewalkingdead both focus on TV shows, startrek is less dynamic than the median community, while thewalkingdead is among the most dynamic communities, as the show was still airing during the years considered.",Question 1: How does the use of nouns provide a convenient degree of interpretability in the context of Reddit?,"Answer 1: In the context of Reddit, using nouns provides a convenient degree of interpretability as we can easily understand the implication of a community preferentially mentioning a noun such as gamer or feminist, but interpreting the overuse of verbs or function words such as take or of is less straightforward. Additionally, in focusing on nouns, we adopt the view emphasized in modern “third wave” accounts of sociolinguistic variation, that stylistic variation is inseparable from topical content, and the choice of what people choose to talk about serves as a primary signal of social identity."
"The authors thank Liye Fu, Jack Hessel, David Jurgens and Lillian Lee for their helpful comments. This research has been supported in part by a Discovery and Innovation Research Seed Award from the Office of the Vice Provost for Research at Cornell, NSF CNS-1010921, IIS-1149837, IIS-1514268 NIH BD2K, ARO MURI, DARPA XDATA, DARPA SIMPLEX, DARPA NGS2, Stanford Data Science Initiative, SAP Stanford Graduate Fellowship, NSERC PGS-D, Boeing, Lightspeed, and Volkswagen. ",Question 1: What organizations and institutions provided funding for this research?,"Answer 1: This research has been supported in part by a Discovery and Innovation Research Seed Award from the Office of the Vice Provost for Research at Cornell, NSF CNS-1010921, IIS-1149837, IIS-1514268 NIH BD2K, ARO MURI, DARPA XDATA, DARPA SIMPLEX, DARPA NGS2, Stanford Data Science Initiative, SAP Stanford Graduate Fellowship, NSERC PGS-D, Boeing, Lightspeed, and Volkswagen."
"A community's identity derives from its members' common interests and shared experiences BIBREF15 , BIBREF20 . In this work, we structure the multi-community landscape along these two key dimensions of community identity: how distinctive a community's interests are, and how dynamic the community is over time..We now proceed to outline our quantitative typology, which maps communities along these two dimensions. We start by providing an intuition through inspecting a few example communities. We then introduce a generalizable language-based methodology and use it to map a large set of Reddit communities onto the landscape defined by our typology of community identity.",What are the two key dimensions used to structure the multi-community landscape in this work?,The two key dimensions used to structure the multi-community landscape in this work are how distinctive a community's interests are and how dynamic the community is over time.
"Natural language understanding research on poetry has investigated stylistic variation BIBREF15, BIBREF16, BIBREF17, with a focus on broadly accepted formal features such as meter BIBREF18, BIBREF19, BIBREF20 and rhyme BIBREF21, BIBREF22, as well as enjambement BIBREF23, BIBREF24 and metaphor BIBREF25, BIBREF26. Recent work has also explored the relationship of poetry and prose, mainly on a syntactic level BIBREF27, BIBREF28. Furthermore, poetry also lends itself well to semantic (change) analysis BIBREF29, BIBREF30, as linguistic invention BIBREF31, BIBREF32 and succinctness BIBREF33 are at the core of poetic production..Corpus-based analysis of emotions in poetry has been considered, but there is no work on German, and little on English. kao2015computational analyze English poems with word associations from the Harvard Inquirer and LIWC, within the categories positive/negative outlook, positive/negative emotion and phys./psych. well-being. hou-frank-2015-analyzing examine the binary sentiment polarity of Chinese poems with a weighted personalized PageRank algorithm. barros2013automatic followed a tagging approach with a thesaurus to annotate words that are similar to the words `Joy', `Anger', `Fear' and `Sadness' (moreover translating these from English to Spanish). With these word lists, they distinguish the categories `Love', `Songs to Lisi', `Satire' and `Philosophical-Moral-Religious' in Quevedo's poetry. Similarly, alsharif2013emotion classify unique Arabic `emotional text forms' based on word unigrams..Mohanty2018 create a corpus of 788 poems in the Indian Odia language, annotate it on text (poem) level with binary negative and positive sentiment, and are able to distinguish these with moderate success. Sreeja2019 construct a corpus of 736 Indian language poems and annotate the texts on Ekman's six categories + Love + Courage. They achieve a Fleiss Kappa of .48..In contrast to our work, these studies focus on basic emotions and binary sentiment polarity only, rather than addressing aesthetic emotions. Moreover, they annotate on the level of complete poems (instead of fine-grained verse and stanza-level).",What is the focus of previous natural language understanding research on poetry?,"The focus of previous natural language understanding research on poetry has been on stylistic variation, including formal features such as meter and rhyme, as well as enjambement and metaphor. Semantic analysis has also been explored, as well as the relationship between poetry and prose. However, previous studies have primarily focused on basic emotions and binary sentiment polarity, rather than addressing aesthetic emotions, and have annotated on the level of complete poems instead of fine-grained verse and stanza-level."
"The task of emotion classification has been tackled before using rule-based and machine learning approaches. Rule-based emotion classification typically relies on lexical resources of emotionally charged words BIBREF9, BIBREF37, BIBREF8 and offers a straightforward and transparent way to detect emotions in text..In contrast to rule-based approaches, current models for emotion classification are often based on neural networks and commonly use word embeddings as features. Schuff2017 applied models from the classes of CNN, BiLSTM, and LSTM and compare them to linear classifiers (SVM and MaxEnt), where the BiLSTM shows best results with the most balanced precision and recall. AbdulMageed2017 claim the highest F$_1$ with gated recurrent unit networks BIBREF38 for Plutchik's emotion model. More recently, shared tasks on emotion analysis BIBREF39, BIBREF40 triggered a set of more advanced deep learning approaches, including BERT BIBREF41 and other transfer learning methods BIBREF42.",Question 1: What is the difference between rule-based and current models for emotion classification?,"Answer 1: Rule-based approaches rely on lexical resources of emotionally charged words and offer a straightforward way to detect emotions in text, while current models for emotion classification are often based on neural networks and commonly use word embeddings as features. These models, such as BiLSTM, LSTM, and deep transfer learning methods, have been shown to achieve better results in emotion classification tasks."
"Emotion corpora have been created for different tasks and with different annotation strategies, with different units of analysis and different foci of emotion perspective (reader, writer, text). Examples include the ISEAR dataset BIBREF34 (document-level); emotion annotation in children stories BIBREF10 and news headlines BIBREF35 (sentence-level); and fine-grained emotion annotation in literature by Kim2018 (phrase- and word-level). We refer the interested reader to an overview paper on existing corpora BIBREF36..We are only aware of a limited number of publications which look in more depth into the emotion perspective. buechel-hahn-2017-emobank report on an annotation study that focuses both on writer's and reader's emotions associated with English sentences. The results show that the reader perspective yields better inter-annotator agreement. Yang2009 also study the difference between writer and reader emotions, but not with a modeling perspective. The authors find that positive reader emotions tend to be linked to positive writer emotions in online blogs.",What are some examples of emotion corpora and what units of analysis do they focus on?,"Examples of emotion corpora include the ISEAR dataset (document-level), emotion annotation in children stories and news headlines (sentence-level), and fine-grained emotion annotation in literature (phrase- and word-level). These corpora have different annotation strategies and foci of emotion perspective, ranging from the reader, writer, to the text."
"To estimate the difficulty of automatic classification of our data set, we perform multi-label document classification (of stanzas) with BERT BIBREF41. For this experiment we aggregate all labels for a stanza and sort them by frequency, both for the gold standard and the raw expert annotations. As can be seen in Figure FIGREF23, a stanza bears a minimum of one and a maximum of four emotions. Unfortunately, the label Nostalgia is only available 16 times in the German data (the gold standard) as a second label (as discussed in Section SECREF19). None of our models was able to learn this label for German. Therefore we omit it, leaving us with eight proper labels..We use the code and the pre-trained BERT models of Farm, provided by deepset.ai. We test the multilingual-uncased model (Multiling), the german-base-cased model (Base), the german-dbmdz-uncased model (Dbmdz), and we tune the Base model on 80k stanzas of the German Poetry Corpus DLK BIBREF30 for 2 epochs, both on token (masked words) and sequence (next line) prediction (Base$_{\textsc {Tuned}}$)..We split the randomized German dataset so that each label is at least 10 times in the validation set (63 instances, 113 labels), and at least 10 times in the test set (56 instances, 108 labels) and leave the rest for training (617 instances, 946 labels). We train BERT for 10 epochs (with a batch size of 8), optimize with entropy loss, and report F1-micro on the test set. See Table TABREF36 for the results..We find that the multilingual model cannot handle infrequent categories, i.e., Awe/Sublime, Suspense and Humor. However, increasing the dataset with English data improves the results, suggesting that the classification would largely benefit from more annotated data. The best model overall is DBMDZ (.520), showing a balanced response on both validation and test set. See Table TABREF37 for a breakdown of all emotions as predicted by the this model. Precision is mostly higher than recall. The labels Awe/Sublime, Suspense and Humor are harder to predict than the other labels..The BASE and BASE$_{\textsc {TUNED}}$ models perform slightly worse than DBMDZ. The effect of tuning of the BASE model is questionable, probably because of the restricted vocabulary (30k). We found that tuning on poetry does not show obvious improvements. Lastly, we find that models that were trained on lines (instead of stanzas) do not achieve the same F1 (~.42 for the German models).",Question 1: What labels were used in the multi-label document classification experiment and how many emotions are associated with each stanza?,"Answer 1: Eight proper labels were used in the multi-label document classification experiment: Joy, Love, Sadness, Anger, Fear, Disgust, Enthusiasm, and Surprise. Each stanza bears a minimum of one and a maximum of four emotions."
"Emotions are central to human experience, creativity and behavior. Models of affect and emotion, both in psychology and natural language processing, commonly operate on predefined categories, designated either by continuous scales of, e.g., Valence, Arousal and Dominance BIBREF0 or discrete emotion labels (which can also vary in intensity). Discrete sets of emotions often have been motivated by theories of basic emotions, as proposed by Ekman1992—Anger, Fear, Joy, Disgust, Surprise, Sadness—and Plutchik1991, who added Trust and Anticipation. These categories are likely to have evolved as they motivate behavior that is directly relevant for survival. However, art reception typically presupposes a situation of safety and therefore offers special opportunities to engage in a broader range of more complex and subtle emotions. These differences between real-life and art contexts have not been considered in natural language processing work so far..To emotionally move readers is considered a prime goal of literature since Latin antiquity BIBREF1, BIBREF2, BIBREF3. Deeply moved readers shed tears or get chills and goosebumps even in lab settings BIBREF4. In cases like these, the emotional response actually implies an aesthetic evaluation: narratives that have the capacity to move readers are evaluated as good and powerful texts for this very reason. Similarly, feelings of suspense experienced in narratives not only respond to the trajectory of the plot's content, but are also directly predictive of aesthetic liking (or disliking). Emotions that exhibit this dual capacity have been defined as “aesthetic emotions” BIBREF2. Contrary to the negativity bias of classical emotion catalogues, emotion terms used for aesthetic evaluation purposes include far more positive than negative emotions. At the same time, many overall positive aesthetic emotions encompass negative or mixed emotional ingredients BIBREF2, e.g., feelings of suspense include both hopeful and fearful anticipations..For these reasons, we argue that the analysis of literature (with a focus on poetry) should rely on specifically selected emotion items rather than on the narrow range of basic emotions only. Our selection is based on previous research on this issue in psychological studies on art reception and, specifically, on poetry. For instance, knoop2016mapping found that Beauty is a major factor in poetry reception..We primarily adopt and adapt emotion terms that schindler2017measuring have identified as aesthetic emotions in their study on how to measure and categorize such particular affective states. Further, we consider the aspect that, when selecting specific emotion labels, the perspective of annotators plays a major role. Whether emotions are elicited in the reader, expressed in the text, or intended by the author largely changes the permissible labels. For example, feelings of Disgust or Love might be intended or expressed in the text, but the text might still fail to elicit corresponding feelings as these concepts presume a strong reaction in the reader. Our focus here was on the actual emotional experience of the readers rather than on hypothetical intentions of authors. We opted for this reader perspective based on previous research in NLP BIBREF5, BIBREF6 and work in empirical aesthetics BIBREF7, that specifically measured the reception of poetry. Our final set of emotion labels consists of Beauty/Joy, Sadness, Uneasiness, Vitality, Suspense, Awe/Sublime, Humor, Annoyance, and Nostalgia..In addition to selecting an adapted set of emotions, the annotation of poetry brings further challenges, one of which is the choice of the appropriate unit of annotation. Previous work considers words BIBREF8, BIBREF9, sentences BIBREF10, BIBREF11, utterances BIBREF12, sentence triples BIBREF13, or paragraphs BIBREF14 as the units of annotation. For poetry, reasonable units follow the logical document structure of poems, i.e., verse (line), stanza, and, owing to its relative shortness, the complete text. The more coarse-grained the unit, the more difficult the annotation is likely to be, but the more it may also enable the annotation of emotions in context. We find that annotating fine-grained units (lines) that are hierarchically ordered within a larger context (stanza, poem) caters to the specific structure of poems, where emotions are regularly mixed and are more interpretable within the whole poem. Consequently, we allow the mixing of emotions already at line level through multi-label annotation..The remainder of this paper includes (1) a report of the annotation process that takes these challenges into consideration, (2) a description of our annotated corpora, and (3) an implementation of baseline models for the novel task of aesthetic emotion annotation in poetry. In a first study, the annotators work on the annotations in a closely supervised fashion, carefully reading each verse, stanza, and poem. In a second study, the annotations are performed via crowdsourcing within relatively short time periods with annotators not seeing the entire poem while reading the stanza. Using these two settings, we aim at obtaining a better understanding of the advantages and disadvantages of an expert vs. crowdsourcing setting in this novel annotation task. Particularly, we are interested in estimating the potential of a crowdsourcing environment for the task of self-perceived emotion annotation in poetry, given time and cost overhead associated with in-house annotation process (that usually involve training and close supervision of the annotators)..We provide the final datasets of German and English language poems annotated with reader emotions on verse level at https://github.com/tnhaider/poetry-emotion.","What is the focus of the analysis of literature, particularly poetry, according to the authors?","According to the authors, the analysis of literature, particularly poetry, should focus on specifically selected emotion items rather than on the narrow range of basic emotions only, as emotions play a central role in human experience, creativity and behavior, and aesthetic emotions have a dual capacity of responding to the trajectory of the plot's content and predicting aesthetic liking. The authors argue that their selection of emotion labels is based on previous research on this issue in psychological studies on art reception and, specifically, on poetry."
"The annotation process was initially conducted by three female university students majoring in linguistics and/or literary studies, which we refer to as our “expert annotators”. We used the INCePTION platform for annotation BIBREF44. Starting with the German poems, we annotated in batches of about 16 (and later in some cases 32) poems. After each batch, we computed agreement statistics including heatmaps, and provided this feedback to the annotators. For the first three batches, the three annotators produced a gold standard using a majority vote for each line. Where this was inconclusive, they developed an adjudicated annotation based on discussion. Where necessary, we encouraged the annotators to aim for more consistency, as most of the frequent switching of emotions within a stanza could not be reconstructed or justified..In poems, emotions are regularly mixed (already on line level) and are more interpretable within the whole poem. We therefore annotate lines hierarchically within the larger context of stanzas and the whole poem. Hence, we instruct the annotators to read a complete stanza or full poem, and then annotate each line in the context of its stanza. To reflect on the emotional complexity of poetry, we allow a maximum of two labels per line while avoiding heavy label fluctuations by encouraging annotators to reflect on their feelings to avoid `empty' annotations. Rather, they were advised to use fewer labels and more consistent annotation. This additional constraint is necessary to avoid “wild”, non-reconstructable or non-justified annotations..All subsequent batches (all except the first three) were only annotated by two out of the three initial annotators, coincidentally those two who had the lowest initial agreement with each other. We asked these two experts to use the generated gold standard (48 poems; majority votes of 3 annotators plus manual curation) as a reference (“if in doubt, annotate according to the gold standard”). This eliminated some systematic differences between them and markedly improved the agreement levels, roughly from 0.3–0.5 Cohen's $\kappa $ in the first three batches to around 0.6–0.8 $\kappa $ for all subsequent batches. This annotation procedure relaxes the reader perspective, as we encourage annotators (if in doubt) to annotate how they think the other annotators would annotate. However, we found that this formulation improves the usability of the data and leads to a more consistent annotation.",Question 1: How did the annotators aim for more consistency in their annotations?,"Answer 1: The annotators were encouraged to reflect on their feelings and use fewer labels for more consistent annotations. They were not allowed to use ""wild"" or non-reconstructable annotations. Additionally, all subsequent batches were only annotated by two of the initial annotators, who were asked to use the generated gold standard as a reference, leading to improved agreement levels."
