context,question,answer
"1.1.1.1em.Thomas Haider$^{1,3}$, Steffen Eger$^2$, Evgeny Kim$^3$, Roman Klinger$^3$, Winfried Menninghaus$^1$.$^{1}$Department of Language and Literature, Max Planck Institute for Empirical Aesthetics.$^{2}$NLLG, Department of Computer Science, Technische Universitat Darmstadt.$^{3}$Institut für Maschinelle Sprachverarbeitung, University of Stuttgart.{thomas.haider, w.m}@ae.mpg.de, eger@aiphes.tu-darmstadt.de.{roman.klinger, evgeny.kim}@ims.uni-stuttgart.de.Most approaches to emotion analysis regarding social media, literature, news, and other domains focus exclusively on basic emotion categories as defined by Ekman or Plutchik. However, art (such as literature) enables engagement in a broader range of more complex and subtle emotions that have been shown to also include mixed emotional responses. We consider emotions as they are elicited in the reader, rather than what is expressed in the text or intended by the author. Thus, we conceptualize a set of aesthetic emotions that are predictive of aesthetic appreciation in the reader, and allow the annotation of multiple labels per line to capture mixed emotions within context. We evaluate this novel setting in an annotation experiment both with carefully trained experts and via crowdsourcing. Our annotation with experts leads to an acceptable agreement of $\kappa =.70$, resulting in a consistent dataset for future large scale analysis. Finally, we conduct first emotion classification experiments based on BERT, showing that identifying aesthetic emotions is challenging in our data, with up to .52 F1-micro on the German subset. Data and resources are available at https://github.com/tnhaider/poetry-emotion..Emotion, Aesthetic Emotions, Literature, Poetry, Annotation, Corpora, Emotion Recognition, Multi-Label","What approach to emotion analysis regarding social media, literature, news, and other domains do most approaches focus on? ","Most approaches to emotion analysis regarding social media, literature, news, and other domains focus exclusively on basic emotion categories as defined by Ekman or Plutchik."
1.1.1em,"Question 1: What does ""1.1.1em"" refer to?","Answer 1: ""1.1.1em"" is a value used to define the size of text or spacing on a webpage. It specifically refers to the measurement of the font size in relation to the size of the letter ""m"" in the chosen font."
1.1em,Question 1: What does the font size 1.1em mean?,Answer 1: The font size 1.1em is equivalent to 110% of the standard font size specified by the browser. It is a relative unit of measurement that adjusts the font size according to the default font size set by the user.
"Learning affective events is closely related to sentiment analysis. Whereas sentiment analysis usually focuses on the polarity of what are described (e.g., movies), we work on how people are typically affected by events. In sentiment analysis, much attention has been paid to compositionality. Word-level polarity BIBREF5, BIBREF6, BIBREF7 and the roles of negation and intensification BIBREF8, BIBREF6, BIBREF9 are among the most important topics. In contrast, we are more interested in recognizing the sentiment polarity of an event that pertains to commonsense knowledge (e.g., getting money and catching cold)..Label propagation from seed instances is a common approach to inducing sentiment polarities. While BIBREF5 and BIBREF10 worked on word- and phrase-level polarities, BIBREF0 dealt with event-level polarities. BIBREF5 and BIBREF10 linked instances using co-occurrence information and/or phrase-level coordinations (e.g., “$A$ and $B$” and “$A$ but $B$”). We shift our scope to event pairs that are more complex than phrase pairs, and consequently exploit discourse connectives as event-level counterparts of phrase-level conjunctions..BIBREF0 constructed a network of events using word embedding-derived similarities. Compared with this method, our discourse relation-based linking of events is much simpler and more intuitive..Some previous studies made use of document structure to understand the sentiment. BIBREF11 proposed a sentiment-specific pre-training strategy using unlabeled dialog data (tweet-reply pairs). BIBREF12 proposed a method of building a polarity-tagged corpus (ACP Corpus). They automatically gathered sentences that had positive or negative opinions utilizing HTML layout structures in addition to linguistic patterns. Our method depends only on raw texts and thus has wider applicability..",Question 1: What is the main difference between sentiment analysis and learning affective events?,"Answer 1: While sentiment analysis mainly focuses on the polarity of what is being described (e.g., movies), learning affective events is concerned with how people are typically affected by events."
".Our goal is to learn the polarity function $p(x)$, which predicts the sentiment polarity score of an event $x$. We approximate $p(x)$ by a neural network with the following form:.${\rm Encoder}$ outputs a vector representation of the event $x$. ${\rm Linear}$ is a fully-connected layer and transforms the representation into a scalar. ${\rm tanh}$ is the hyperbolic tangent and transforms the scalar into a score ranging from $-1$ to 1. In Section SECREF21, we consider two specific implementations of ${\rm Encoder}$..",Question 1: What is the goal of the neural network described in this text?,"Answer 1: The goal is to learn the polarity function p(x), which predicts the sentiment polarity score of an event x."
"Using AL, CA, and CO data, we optimize the parameters of the polarity function $p(x)$. We define a loss function for each of the three types of event pairs and sum up the multiple loss functions..We use mean squared error to construct loss functions. For the AL data, the loss function is defined as:.where $x_{i1}$ and $x_{i2}$ are the $i$-th pair of the AL data. $r_{i1}$ and $r_{i2}$ are the automatically-assigned scores of $x_{i1}$ and $x_{i2}$, respectively. $N_{\rm AL}$ is the total number of AL pairs, and $\lambda _{\rm AL}$ is a hyperparameter..For the CA data, the loss function is defined as:.$y_{i1}$ and $y_{i2}$ are the $i$-th pair of the CA pairs. $N_{\rm CA}$ is the total number of CA pairs. $\lambda _{\rm CA}$ and $\mu $ are hyperparameters. The first term makes the scores of the two events closer while the second term prevents the scores from shrinking to zero..The loss function for the CO data is defined analogously:.The difference is that the first term makes the scores of the two events distant from each other..",Question 1: What is the purpose of defining a loss function for each type of event pair in the optimization process for the polarity function?,Answer 1: The purpose of defining a loss function for each type of event pair is to quantify the discrepancy between the automatically-assigned scores and the optimized scores produced by the polarity function. This discrepancy is used to optimize the parameters of the polarity function using mean squared error as the loss metric.
"The seed lexicon matches neither the former nor the latter event, and their discourse relation type is Concession. We assume the two events have the reversed polarities..",Question 1: What is the discourse relation type between the two events mentioned in the text and why is it classified as such?,"Answer 1: The discourse relation type between the two events is Concession because the seed lexicon does not match either event and it is assumed that the two events have reversed polarities, indicating a sense of contradiction or opposition."
"The seed lexicon matches neither the former nor the latter event, and their discourse relation type is Cause. We assume the two events have the same polarities..",Question 1: What is the discourse relation between the two events in the given text?,Answer 1: The discourse relation between the two events in the given text is Cause.
"The seed lexicon matches (1) the latter event but (2) not the former event, and (3) their discourse relation type is Cause or Concession. If the discourse relation type is Cause, the former event is given the same score as the latter. Likewise, if the discourse relation type is Concession, the former event is given the opposite of the latter's score. They are used as reference scores during training..",Question 1: What type of discourse relation leads to the former event being given the opposite score of the latter event in the seed lexicon?,"Answer 1: If the discourse relation type is Concession, the former event is given the opposite of the latter's score in the seed lexicon."
"Our method requires a very small seed lexicon and a large raw corpus. We assume that we can automatically extract discourse-tagged event pairs, $(x_{i1}, x_{i2})$ ($i=1, \cdots $) from the raw corpus. We refer to $x_{i1}$ and $x_{i2}$ as former and latter events, respectively. As shown in Figure FIGREF1, we limit our scope to two discourse relations: Cause and Concession..The seed lexicon consists of positive and negative predicates. If the predicate of an extracted event is in the seed lexicon and does not involve complex phenomena like negation, we assign the corresponding polarity score ($+1$ for positive events and $-1$ for negative events) to the event. We expect the model to automatically learn complex phenomena through label propagation. Based on the availability of scores and the types of discourse relations, we classify the extracted event pairs into the following three types..",Question 1: What is the required size of the seed lexicon in the method described?,Answer 6: The extracted event pairs are classified into three types based on availability of scores and discourse relation types.
"Affective events BIBREF0 are events that typically affect people in positive or negative ways. For example, getting money and playing sports are usually positive to the experiencers; catching cold and losing one's wallet are negative. Understanding affective events is important to various natural language processing (NLP) applications such as dialogue systems BIBREF1, question-answering systems BIBREF2, and humor recognition BIBREF3. In this paper, we work on recognizing the polarity of an affective event that is represented by a score ranging from $-1$ (negative) to 1 (positive)..Learning affective events is challenging because, as the examples above suggest, the polarity of an event is not necessarily predictable from its constituent words. Combined with the unbounded combinatorial nature of language, the non-compositionality of affective polarity entails the need for large amounts of world knowledge, which can hardly be learned from small annotated data..In this paper, we propose a simple and effective method for learning affective events that only requires a very small seed lexicon and a large raw corpus. As illustrated in Figure FIGREF1, our key idea is that we can exploit discourse relations BIBREF4 to efficiently propagate polarity from seed predicates that directly report one's emotions (e.g., “to be glad” is positive). Suppose that events $x_1$ are $x_2$ are in the discourse relation of Cause (i.e., $x_1$ causes $x_2$). If the seed lexicon suggests $x_2$ is positive, $x_1$ is also likely to be positive because it triggers the positive emotion. The fact that $x_2$ is known to be negative indicates the negative polarity of $x_1$. Similarly, if $x_1$ and $x_2$ are in the discourse relation of Concession (i.e., $x_2$ in spite of $x_1$), the reverse of $x_2$'s polarity can be propagated to $x_1$. Even if $x_2$'s polarity is not known in advance, we can exploit the tendency of $x_1$ and $x_2$ to be of the same polarity (for Cause) or of the reverse polarity (for Concession) although the heuristic is not exempt from counterexamples. We transform this idea into objective functions and train neural network models that predict the polarity of a given event..We trained the models using a Japanese web corpus. Given the minimum amount of supervision, they performed well. In addition, the combination of annotated and unannotated data yielded a gain over a purely supervised baseline when labeled data were small.",What is the key idea proposed in the paper for learning affective events?,The key idea proposed in the paper for learning affective events is to exploit discourse relations to efficiently propagate polarity from seed predicates that directly report one's emotions. This involves using a small seed lexicon and a large raw corpus to train neural network models that predict the polarity of a given event. The models can identify the positive or negative affective polarity of events based on their discourse relations.
".Table TABREF23 shows accuracy. As the Random baseline suggests, positive and negative labels were distributed evenly. The Random+Seed baseline made use of the seed lexicon and output the corresponding label (or the reverse of it for negation) if the event's predicate is in the seed lexicon. We can see that the seed lexicon itself had practically no impact on prediction..The models in the top block performed considerably better than the random baselines. The performance gaps with their (semi-)supervised counterparts, shown in the middle block, were less than 7%. This demonstrates the effectiveness of discourse relation-based label propagation..Comparing the model variants, we obtained the highest score with the BiGRU encoder trained with the AL+CA+CO dataset. BERT was competitive but its performance went down if CA and CO were used in addition to AL. We conjecture that BERT was more sensitive to noises found more frequently in CA and CO..Contrary to our expectations, supervised models (ACP) outperformed semi-supervised models (ACP+AL+CA+CO). This suggests that the training set of 0.6 million events is sufficiently large for training the models. For comparison, we trained the models with a subset (6,000 events) of the ACP dataset. As the results shown in Table TABREF24 demonstrate, our method is effective when labeled data are small..The result of hyperparameter optimization for the BiGRU encoder was as follows:.As the CA and CO pairs were equal in size (Table TABREF16), $\lambda _{\rm CA}$ and $\lambda _{\rm CO}$ were comparable values. $\lambda _{\rm CA}$ was about one-third of $\lambda _{\rm CO}$, and this indicated that the CA pairs were noisier than the CO pairs. A major type of CA pairs that violates our assumption was in the form of “$\textit {problem}_{\text{negative}}$ causes $\textit {solution}_{\text{positive}}$”:.. (悪いところがある, よくなるように努力する).(there is a bad point, [I] try to improve [it]).The polarities of the two events were reversed in spite of the Cause relation, and this lowered the value of $\lambda _{\rm CA}$..Some examples of model outputs are shown in Table TABREF26. The first two examples suggest that our model successfully learned negation without explicit supervision. Similarly, the next two examples differ only in voice but the model correctly recognized that they had opposite polarities. The last two examples share the predicate “落とす"" (drop) and only the objects are different. The second event “肩を落とす"" (lit. drop one's shoulders) is an idiom that expresses a disappointed feeling. The examples demonstrate that our model correctly learned non-compositional expressions..",Question 1: Which model had the highest score in the accuracy test?,Answer 1: The BiGRU encoder trained with the AL+CA+CO dataset had the highest score in the accuracy test.
"As for ${\rm Encoder}$, we compared two types of neural networks: BiGRU and BERT. GRU BIBREF16 is a recurrent neural network sequence encoder. BiGRU reads an input sequence forward and backward and the output is the concatenation of the final forward and backward hidden states..BERT BIBREF17 is a pre-trained multi-layer bidirectional Transformer BIBREF18 encoder. Its output is the final hidden state corresponding to the special classification tag ([CLS]). For the details of ${\rm Encoder}$, see Sections SECREF30..We trained the model with the following four combinations of the datasets: AL, AL+CA+CO (two proposed models), ACP (supervised), and ACP+AL+CA+CO (semi-supervised). The corresponding objective functions were: $\mathcal {L}_{\rm AL}$, $\mathcal {L}_{\rm AL} + \mathcal {L}_{\rm CA} + \mathcal {L}_{\rm CO}$, $\mathcal {L}_{\rm ACP}$, and $\mathcal {L}_{\rm ACP} + \mathcal {L}_{\rm AL} + \mathcal {L}_{\rm CA} + \mathcal {L}_{\rm CO}$..",Question 1: What are the two types of neural networks compared in the text?,"Answer 1: The two types of neural networks compared in the text are BiGRU and BERT. BiGRU is a recurrent neural network sequence encoder, while BERT is a pre-trained multi-layer bidirectional Transformer encoder."
"As a raw corpus, we used a Japanese web corpus that was compiled through the procedures proposed by BIBREF13. To extract event pairs tagged with discourse relations, we used the Japanese dependency parser KNP and in-house postprocessing scripts BIBREF14. KNP used hand-written rules to segment each sentence into what we conventionally called clauses (mostly consecutive text chunks), each of which contained one main predicate. KNP also identified the discourse relations of event pairs if explicit discourse connectives BIBREF4 such as “ので” (because) and “のに” (in spite of) were present. We treated Cause/Reason (原因・理由) and Condition (条件) in the original tagset BIBREF15 as Cause and Concession (逆接) as Concession, respectively. Here is an example of event pair extraction... 重大な失敗を犯したので、仕事をクビになった。.Because [I] made a serious mistake, [I] got fired..From this sentence, we extracted the event pair of “重大な失敗を犯す” ([I] make a serious mistake) and “仕事をクビになる” ([I] get fired), and tagged it with Cause..We constructed our seed lexicon consisting of 15 positive words and 15 negative words, as shown in Section SECREF27. From the corpus of about 100 million sentences, we obtained 1.4 millions event pairs for AL, 41 millions for CA, and 6 millions for CO. We randomly selected subsets of AL event pairs such that positive and negative latter events were equal in size. We also sampled event pairs for each of CA and CO such that it was five times larger than AL. The results are shown in Table TABREF16.",What is the seed lexicon and how was it constructed?,The seed lexicon consists of 15 positive words and 15 negative words. It was constructed based on a section shown in the paper and is used in the extraction of causal relations in the text corpus.
"We used the latest version of the ACP Corpus BIBREF12 for evaluation. It was used for (semi-)supervised training as well. Extracted from Japanese websites using HTML layouts and linguistic patterns, the dataset covered various genres. For example, the following two sentences were labeled positive and negative, respectively:.. 作業が楽だ。.The work is easy... 駐車場がない。.There is no parking lot..Although the ACP corpus was originally constructed in the context of sentiment analysis, we found that it could roughly be regarded as a collection of affective events. We parsed each sentence and extracted the last clause in it. The train/dev/test split of the data is shown in Table TABREF19..The objective function for supervised training is:..where $v_i$ is the $i$-th event, $R_i$ is the reference score of $v_i$, and $N_{\rm ACP}$ is the number of the events of the ACP Corpus..To optimize the hyperparameters, we used the dev set of the ACP Corpus. For the evaluation, we used the test set of the ACP Corpus. The model output was classified as positive if $p(x) > 0$ and negative if $p(x) \le 0$..",What is the ACP Corpus and how was it used in the study?,"The ACP Corpus is a dataset extracted from Japanese websites using HTML layouts and linguistic patterns, covering various genres. It was used for (semi-)supervised training and evaluation in the study. It was originally constructed in the context of sentiment analysis, but could be regarded as a collection of affective events. The last clause of each sentence was extracted and used for analysis. The model output was classified as positive or negative based on the probability score. The dev and test sets of the ACP Corpus were used for hyperparameter optimization and evaluation, respectively."
"In this paper, we proposed to use discourse relations to effectively propagate polarities of affective events from seeds. Experiments show that, even with a minimal amount of supervision, the proposed method performed well..Although event pairs linked by discourse analysis are shown to be useful, they nevertheless contain noises. Adding linguistically-motivated filtering rules would help improve the performance.",Q1: What is the proposed method in the paper?,A1: The proposed method in this paper is to use discourse relations to effectively propagate polarities of affective events from seeds.
"The dimension of the embedding layer was 256. The embedding layer was initialized with the word embeddings pretrained using the Web corpus. The input sentences were segmented into words by the morphological analyzer Juman++. The vocabulary size was 100,000. The number of hidden layers was 2. The dimension of hidden units was 256. The optimizer was Momentum SGD BIBREF21. The mini-batch size was 1024. We ran 100 epochs and selected the snapshot that achieved the highest score for the dev set.",Question 1: What was the dimension of the hidden units used in the model?,Answer 1: The dimension of the hidden units was 256.
"We used a Japanese BERT model pretrained with Japanese Wikipedia. The input sentences were segmented into words by Juman++, and words were broken into subwords by applying BPE BIBREF20. The vocabulary size was 32,000. The maximum length of an input sequence was 128. The number of hidden layers was 12. The dimension of hidden units was 768. The number of self-attention heads was 12. The optimizer was Adam BIBREF19. The mini-batch size was 32. We ran 1 epoch.",Question 1: What was the vocabulary size for the Japanese BERT model?,"Answer 1: The vocabulary size for the Japanese BERT model was 32,000."
"喜ぶ (rejoice), 嬉しい (be glad), 楽しい (be pleasant), 幸せ (be happy), 感動 (be impressed), 興奮 (be excited), 懐かしい (feel nostalgic), 好き (like), 尊敬 (respect), 安心 (be relieved), 感心 (admire), 落ち着く (be calm), 満足 (be satisfied), 癒される (be healed), and スッキリ (be refreshed).",Question 1: How did you feel when you saw your old childhood friend after many years?,Answer 1: I felt 懐かしい (nostalgic) seeing my old friend.
"怒る (get angry), 悲しい (be sad), 寂しい (be lonely), 怖い (be scared), 不安 (feel anxious), 恥ずかしい (be embarrassed), 嫌 (hate), 落ち込む (feel down), 退屈 (be bored), 絶望 (feel hopeless), 辛い (have a hard time), 困る (have trouble), 憂鬱 (be depressed), 心配 (be worried), and 情けない (be sorry).","Question 1: How do you say ""be scared"" in Japanese?","Answer 1: ""Be scared"" in Japanese is 怖い (kowai)."
We thank Nobuhiro Kaji for providing the ACP Corpus and Hirokazu Kiyomaru and Yudai Kishimoto for their help in extracting event pairs. This work was partially supported by Yahoo! Japan Corporation.,Question 1: Who provided the ACP Corpus and who helped in extracting event pairs for the work mentioned?,Answer 1: Nobuhiro Kaji provided the ACP Corpus and Hirokazu Kiyomaru and Yudai Kishimoto helped in extracting event pairs for the work.
"The dimension of the embedding layer was 256. The embedding layer was initialized with the word embeddings pretrained using the Web corpus. The input sentences were segmented into words by the morphological analyzer Juman++. The vocabulary size was 100,000. The number of hidden layers was 2. The dimension of hidden units was 256. The optimizer was Momentum SGD BIBREF21. The mini-batch size was 1024. We ran 100 epochs and selected the snapshot that achieved the highest score for the dev set.",Question 1: Which optimizer was used for training the model?,Answer 1: The optimizer used for training the model was Momentum SGD BIBREF21.
"We used a Japanese BERT model pretrained with Japanese Wikipedia. The input sentences were segmented into words by Juman++, and words were broken into subwords by applying BPE BIBREF20. The vocabulary size was 32,000. The maximum length of an input sequence was 128. The number of hidden layers was 12. The dimension of hidden units was 768. The number of self-attention heads was 12. The optimizer was Adam BIBREF19. The mini-batch size was 32. We ran 1 epoch.",Question 1: What was the vocabulary size used for the Japanese BERT model? ,"Answer 1: The vocabulary size used for the Japanese BERT model was 32,000."
"喜ぶ (rejoice), 嬉しい (be glad), 楽しい (be pleasant), 幸せ (be happy), 感動 (be impressed), 興奮 (be excited), 懐かしい (feel nostalgic), 好き (like), 尊敬 (respect), 安心 (be relieved), 感心 (admire), 落ち着く (be calm), 満足 (be satisfied), 癒される (be healed), and スッキリ (be refreshed).",Question 1: How would you describe the feeling of being relieved?,"Answer 1: It can be described as ""安心 (anshin)""."
"怒る (get angry), 悲しい (be sad), 寂しい (be lonely), 怖い (be scared), 不安 (feel anxious), 恥ずかしい (be embarrassed), 嫌 (hate), 落ち込む (feel down), 退屈 (be bored), 絶望 (feel hopeless), 辛い (have a hard time), 困る (have trouble), 憂鬱 (be depressed), 心配 (be worried), and 情けない (be sorry).",Question 1: How do you express feeling embarrassed in Japanese?,"Answer 1: Embarrassed in Japanese can be expressed as ""恥ずかしい"" (hazukashii)."
