context,question,answer
"We opt for measuring the reader perspective rather than the text surface or author's intent. To closer define and support conceptualizing our labels, we use particular `items', as they are used in psychological self-evaluations. These items consist of adjectives, verbs or short phrases. We build on top of schindler2017measuring who proposed 43 items that were then grouped by a factor analysis based on self-evaluations of participants. The resulting factors are shown in Table TABREF17. We attempt to cover all identified factors and supplement with basic emotions BIBREF46, BIBREF47, where possible..We started with a larger set of labels to then delete and substitute (tone down) labels during the initial annotation process to avoid infrequent classes and inconsistencies. Further, we conflate labels if they show considerable confusion with each other. These iterative improvements particularly affected Confusion, Boredom and Other that were very infrequently annotated and had little agreement among annotators ($\kappa <.2$). For German, we also removed Nostalgia ($\kappa =.218$) after gold standard creation, but after consideration, added it back for English, then achieving agreement. Nostalgia is still available in the gold standard (then with a second label Beauty/Joy or Sadness to keep consistency). However, Confusion, Boredom and Other are not available in any sub-corpus..Our final set consists of nine classes, i.e., (in order of frequency) Beauty/Joy, Sadness, Uneasiness, Vitality, Suspense, Awe/Sublime, Humor, Annoyance, and Nostalgia. In the following, we describe the labels and give further details on the aggregation process..Annoyance (annoys me/angers me/felt frustrated): Annoyance implies feeling annoyed, frustrated or even angry while reading the line/stanza. We include the class Anger here, as this was found to be too strong in intensity..Awe/Sublime (found it overwhelming/sense of greatness): Awe/Sublime implies being overwhelmed by the line/stanza, i.e., if one gets the impression of facing something sublime or if the line/stanza inspires one with awe (or that the expression itself is sublime). Such emotions are often associated with subjects like god, death, life, truth, etc. The term Sublime originated with kant2000critique as one of the first aesthetic emotion terms. Awe is a more common English term..Beauty/Joy (found it beautiful/pleasing/makes me happy/joyful): kant2000critique already spoke of a “feeling of beauty”, and it should be noted that it is not a `merely pleasing emotion'. Therefore, in our pilot annotations, Beauty and Joy were separate labels. However, schindler2017measuring found that items for Beauty and Joy load into the same factors. Furthermore, our pilot annotations revealed, while Beauty is the more dominant and frequent feeling, both labels regularly accompany each other, and they often get confused across annotators. Therefore, we add Joy to form an inclusive label Beauty/Joy that increases annotation consistency..Humor (found it funny/amusing): Implies feeling amused by the line/stanza or if it makes one laugh..Nostalgia (makes me nostalgic): Nostalgia is defined as a sentimental longing for things, persons or situations in the past. It often carries both positive and negative feelings. However, since this label is quite infrequent, and not available in all subsets of the data, we annotated it with an additional Beauty/Joy or Sadness label to ensure annotation consistency..Sadness (makes me sad/touches me): If the line/stanza makes one feel sad. It also includes a more general `being touched / moved'..Suspense (found it gripping/sparked my interest): Choose Suspense if the line/stanza keeps one in suspense (if the line/stanza excites one or triggers one's curiosity). We further removed Anticipation from Suspense/Anticipation, as Anticipation appeared to us as being a more cognitive prediction whereas Suspense is a far more straightforward emotion item..Uneasiness (found it ugly/unsettling/disturbing / frightening/distasteful): This label covers situations when one feels discomfort about the line/stanza (if the line/stanza feels distasteful/ugly, unsettling/disturbing or frightens one). The labels Ugliness and Disgust were conflated into Uneasiness, as both are seldom felt in poetry (being inadequate/too strong/high in arousal), and typically lead to Uneasiness..Vitality (found it invigorating/spurs me on/inspires me): This label is meant for a line/stanza that has an inciting, encouraging effect (if the line/stanza conveys a feeling of movement, energy and vitality which animates to action). Similar terms are Activation and Stimulation.",What is the final set of emotional labels used in measuring reader perspective in this study?,"The final set of emotional labels used in measuring reader perspective in this study consists of nine classes, listed in order of frequency: Beauty/Joy, Sadness, Uneasiness, Vitality, Suspense, Awe/Sublime, Humor, Annoyance, and Nostalgia (with Nostalgia only included in some cases and annotated with an additional Beauty/Joy or Sadness label for consistency)."
"Table TABREF20 shows the Cohen's $\kappa $ agreement scores among our two expert annotators for each emotion category $e$ as follows. We assign each instance (a line in a poem) a binary label indicating whether or not the annotator has annotated the emotion category $e$ in question. From this, we obtain vectors $v_i^e$, for annotators $i=0,1$, where each entry of $v_i^e$ holds the binary value for the corresponding line. We then apply the $\kappa $ statistics to the two binary vectors $v_i^e$. Additionally to averaged $\kappa $, we report micro-F1 values in Table TABREF21 between the multi-label annotations of both expert annotators as well as the micro-F1 score of a random baseline as well as of the majority emotion baseline (which labels each line as Beauty/Joy)..We find that Cohen $\kappa $ agreement ranges from .84 for Uneasiness in the English data, .81 for Humor and Nostalgia, down to German Suspense (.65), Awe/Sublime (.61) and Vitality for both languages (.50 English, .63 German). Both annotators have a similar emotion frequency profile, where the ranking is almost identical, especially for German. However, for English, Annotator 2 annotates more Vitality than Uneasiness. Figure FIGREF18 shows the confusion matrices of labels between annotators as heatmaps. Notably, Beauty/Joy and Sadness are confused across annotators more often than other labels. This is topical for poetry, and therefore not surprising: One might argue that the beauty of beings and situations is only beautiful because it is not enduring and therefore not to divorce from the sadness of the vanishing of beauty BIBREF48. We also find considerable confusion of Sadness with Awe/Sublime and Vitality, while the latter is also regularly confused with Beauty/Joy..Furthermore, as shown in Figure FIGREF23, we find that no single poem aggregates to more than six emotion labels, while no stanza aggregates to more than four emotion labels. However, most lines and stanzas prefer one or two labels. German poems seem more emotionally diverse where more poems have three labels than two labels, while the majority of English poems have only two labels. This is however attributable to the generally shorter English texts.",Question 1: What is the range of Cohen's $\kappa$ agreement scores among the two expert annotators?,Answer 1: The range of Cohen's $\kappa$ agreement scores among the two expert annotators is from .84 for Uneasiness in the English data to .50 for Vitality in the English data and .63 for Vitality in the German data.
"In the following, we will explain how we compiled and annotated three data subsets, namely, (1) 48 German poems with gold annotation. These were originally annotated by three annotators. The labels were then aggregated with majority voting and based on discussions among the annotators. Finally, they were curated to only include one gold annotation. (2) The remaining 110 German poems that are used to compute the agreement in table TABREF20 and (3) 64 English poems contain the raw annotation from two annotators..We report the genesis of our annotation guidelines including the emotion classes. With the intention to provide a language resource for the computational analysis of emotion in poetry, we aimed at maximizing the consistency of our annotation, while doing justice to the diversity of poetry. We iteratively improved the guidelines and the annotation workflow by annotating in batches, cleaning the class set, and the compilation of a gold standard. The final overall cost of producing this expert annotated dataset amounts to approximately 3,500.",Question 1: How many English poems were included in the annotated dataset?,"Answer 1: There were 64 English poems included in the annotated dataset, and they contained raw annotation from two annotators."
"The German corpus contains poems available from the website lyrik.antikoerperchen.de (ANTI-K), which provides a platform for students to upload essays about poems. The data is available in the Hypertext Markup Language, with clean line and stanza segmentation. ANTI-K also has extensive metadata, including author names, years of publication, numbers of sentences, poetic genres, and literary periods, that enable us to gauge the distribution of poems according to periods. The 158 poems we consider (731 stanzas) are dispersed over 51 authors and the New High German timeline (1575–1936 A.D.). This data has been annotated, besides emotions, for meter, rhythm, and rhyme in other studies BIBREF22, BIBREF43.",Question 1: How many poems are included in the German corpus and over what time period are they dispersed?,"Answer 1: The German corpus contains 158 poems, which are dispersed over 51 authors and the New High German timeline (1575-1936 A.D.)."
"The English corpus contains 64 poems of popular English writers. It was partly collected from Project Gutenberg with the GutenTag tool, and, in addition, includes a number of hand selected poems from the modern period and represents a cross section of popular English poets. We took care to include a number of female authors, who would have been underrepresented in a uniform sample. Time stamps in the corpus are organized by the birth year of the author, as assigned in Project Gutenberg.",Question 1: How was the English corpus collected and what does it include?,"Answer 1: The English corpus was partly collected from Project Gutenberg with the GutenTag tool, and also includes hand selected poems from the modern period. It contains 64 poems from a cross section of popular English poets, including a number of female authors who would otherwise be underrepresented. The time stamps in the corpus are organized by the birth year of the author, as assigned in Project Gutenberg."
"For our annotation and modeling studies, we build on top of two poetry corpora (in English and German), which we refer to as PO-EMO. This collection represents important contributions to the literary canon over the last 400 years. We make this resource available in TEI P5 XML and an easy-to-use tab separated format. Table TABREF9 shows a size overview of these data sets. Figure FIGREF8 shows the distribution of our data over time via density plots. Note that both corpora show a relative underrepresentation before the onset of the romantic period (around 1750).",Question 1: What is the name given to the two poetry corpora used for annotation and modeling studies in English and German?,Answer 1: The two poetry corpora used for annotation and modeling studies in English and German are referred to as PO-EMO.
"In the following, we determine the best aggregation strategy regarding the 10 annotators with bootstrap resampling. For instance, one could assign the label of a specific emotion to an instance if just one annotators picks it, or one could assign the label only if all annotators agree on this emotion. To evaluate this, we repeatedly pick two sets of 5 annotators each out of the 10 annotators for each of the 59 stanzas, 1000 times overall (i.e., 1000$\times $59 times, bootstrap resampling). For each of these repetitions, we compare the agreement of these two groups of 5 annotators. Each group gets assigned with an adjudicated emotion which is accepted if at least one annotator picks it, at least two annotators pick it, etc. up to all five pick it..We show the results in Table TABREF27. The $\kappa $ scores show the average agreement between the two groups of five annotators, when the adjudicated class is picked based on the particular threshold of annotators with the same label choice. We see that some emotions tend to have higher agreement scores than others, namely Annoyance (.66), Sadness (up to .52), and Awe/Sublime, Beauty/Joy, Humor (all .46). The maximum agreement is reached mostly with a threshold of 2 (4 times) or 3 (3 times)..We further show in the same table the average numbers of labels from each strategy. Obviously, a lower threshold leads to higher numbers (corresponding to a disjunction of annotations for each emotion). The drop in label counts is comparably drastic, with on average 18 labels per class. Overall, the best average $\kappa $ agreement (.32) is less than half of what we saw for the expert annotators (roughly .70). Crowds especially disagree on many more intricate emotion labels (Uneasiness, Vitality, Nostalgia, Suspense)..We visualize how often two emotions are used to label an instance in a confusion table in Figure FIGREF18. Sadness is used most often to annotate a stanza, and it is often confused with Suspense, Uneasiness, and Nostalgia. Further, Beauty/Joy partially overlaps with Awe/Sublime, Nostalgia, and Sadness..On average, each crowd annotator uses two emotion labels per stanza (56% of cases); only in 36% of the cases the annotators use one label, and in 6% and 1% of the cases three and four labels, respectively. This contrasts with the expert annotators, who use one label in about 70% of the cases and two labels in 30% of the cases for the same 59 four-liners. Concerning frequency distribution for emotion labels, both experts and crowds name Sadness and Beauty/Joy as the most frequent emotions (for the `best' threshold of 3) and Nostalgia as one of the least frequent emotions. The Spearman rank correlation between experts and crowds is about 0.55 with respect to the label frequency distribution, indicating that crowds could replace experts to a moderate degree when it comes to extracting, e.g., emotion distributions for an author or time period. Now, we further compare crowds and experts in terms of whether crowds could replicate expert annotations also on a finer stanza level (rather than only on a distributional level).","What is the best average kappa agreement between the crowdsourced annotators, and how does it compare to the expert annotators? ","The best average kappa agreement between the crowdsourced annotators is 0.32, which is less than half of what was observed for the expert annotators (roughly 0.70)."
"For consistency and to simplify the task for the annotators, we opt for a trade-off between completeness and granularity of the annotation. Specifically, we subselect stanzas composed of four verses from the corpus of 64 hand selected English poems. The resulting selection of 59 stanzas is uploaded to Figure Eight for annotation..The annotators are asked to answer the following questions for each instance..Question 1 (single-choice): Read the following stanza and decide for yourself which emotions it evokes..Question 2 (multiple-choice): Which additional emotions does the stanza evoke?.The answers to both questions correspond to the emotion labels we defined to use in our annotation, as described in Section SECREF19. We add an additional answer choice “None” to Question 2 to allow annotators to say that a stanza does not evoke any additional emotions..Each instance is annotated by ten people. We restrict the task geographically to the United Kingdom and Ireland and set the internal parameters on Figure Eight to only include the highest quality annotators to join the task. We pay 0.09 per instance. The final cost of the crowdsourcing experiment is 74.",Question 1: What is the annotator asked to do after reading each stanza?,Answer 1: The annotator is asked to decide which emotions the stanza evokes.
"To gauge the quality of the crowd annotations in comparison with our experts, we calculate agreement on the emotions between experts and an increasing group size from the crowd. For each stanza instance $s$, we pick $N$ crowd workers, where $N\in \lbrace 4,6,8,10\rbrace $, then pick their majority emotion for $s$, and additionally pick their second ranked majority emotion if at least $\frac{N}{2}-1$ workers have chosen it. For the experts, we aggregate their emotion labels on stanza level, then perform the same strategy for selection of emotion labels. Thus, for $s$, both crowds and experts have 1 or 2 emotions. For each emotion, we then compute Cohen's $\kappa $ as before. Note that, compared to our previous experiments in Section SECREF26 with a threshold, each stanza now receives an emotion annotation (exactly one or two emotion labels), both by the experts and the crowd-workers..In Figure FIGREF30, we plot agreement between experts and crowds on stanza level as we vary the number $N$ of crowd workers involved. On average, there is roughly a steady linear increase in agreement as $N$ grows, which may indicate that $N=20$ or $N=30$ would still lead to better agreement. Concerning individual emotions, Nostalgia is the emotion with the least agreement, as opposed to Sadness (in our sample of 59 four-liners): the agreement for this emotion grows from $.47$ $\kappa $ with $N=4$ to $.65$ $\kappa $ with $N=10$. Sadness is also the most frequent emotion, both according to experts and crowds. Other emotions for which a reasonable agreement is achieved are Annoyance, Awe/Sublime, Beauty/Joy, Humor ($\kappa $ > 0.2). Emotions with little agreement are Vitality, Uneasiness, Suspense, Nostalgia ($\kappa $ < 0.2)..By and large, we note from Figure FIGREF18 that expert annotation is more restrictive, with experts agreeing more often on particular emotion labels (seen in the darker diagonal). The results of the crowdsourcing experiment, on the other hand, are a mixed bag as evidenced by a much sparser distribution of emotion labels. However, we note that these differences can be caused by 1) the disparate training procedure for the experts and crowds, and 2) the lack of opportunities for close supervision and on-going training of the crowds, as opposed to the in-house expert annotators..In general, however, we find that substituting experts with crowds is possible to a certain degree. Even though the crowds' labels look inconsistent at first view, there appears to be a good signal in their aggregated annotations, helping to approximate expert annotations to a certain degree. The average $\kappa $ agreement (with the experts) we get from $N=10$ crowd workers (0.24) is still considerably below the agreement among the experts (0.70).",What is the emotion with the least agreement between experts and crowd-workers in the study?,Answer 1: The emotion with the least agreement between experts and crowd-workers in the study is Nostalgia.
"After concluding the expert annotation, we performed a focused crowdsourcing experiment, based on the final label set and items as they are listed in Table TABREF27 and Section SECREF19. With this experiment, we aim to understand whether it is possible to collect reliable judgements for aesthetic perception of poetry from a crowdsourcing platform. A second goal is to see whether we can replicate the expensive expert annotations with less costly crowd annotations..We opted for a maximally simple annotation environment, where we asked participants to annotate English 4-line stanzas with self-perceived reader emotions. We choose English due to the higher availability of English language annotators on crowdsourcing platforms. Each annotator rates each stanza independently of surrounding context.",Question 1: What was the goal of the focused crowdsourcing experiment mentioned in the text?,Answer 1: The goal of the focused crowdsourcing experiment was to collect reliable judgements for aesthetic perception of poetry from a crowdsourcing platform and to see whether the expensive expert annotations can be replicated with less costly crowd annotations.
"In this paper, we presented a dataset of German and English poetry annotated with reader response to reading poetry. We argued that basic emotions as proposed by psychologists (such as Ekman and Plutchik) that are often used in emotion analysis from text are of little use for the annotation of poetry reception. We instead conceptualized aesthetic emotion labels and showed that a closely supervised annotation task results in substantial agreement—in terms of $\kappa $ score—on the final dataset..The task of collecting reader-perceived emotion response to poetry in a crowdsourcing setting is not straightforward. In contrast to expert annotators, who were closely supervised and reflected upon the task, the annotators on crowdsourcing platforms are difficult to control and may lack necessary background knowledge to perform the task at hand. However, using a larger number of crowd annotators may lead to finding an aggregation strategy with a better trade-off between quality and quantity of adjudicated labels. For future work, we thus propose to repeat the experiment with larger number of crowdworkers, and develop an improved training strategy that would suit the crowdsourcing environment..The dataset presented in this paper can be of use for different application scenarios, including multi-label emotion classification, style-conditioned poetry generation, investigating the influence of rhythm/prosodic features on emotion, or analysis of authors, genres and diachronic variation (e.g., how emotions are represented differently in certain periods)..Further, though our modeling experiments are still rudimentary, we propose that this data set can be used to investigate the intra-poem relations either through multi-task learning BIBREF49 and/or with the help of hierarchical sequence classification approaches.",Question 1: What is the proposed use of the dataset presented in the paper? ,"Answer 1: The dataset presented in the paper can be used for different application scenarios, including multi-label emotion classification, style-conditioned poetry generation, investigating the influence of rhythm/prosodic features on emotion, or analysis of authors, genres and diachronic variation."
"We illustrate two examples of our German gold standard annotation, a poem each by Friedrich Hölderlin and Georg Trakl, and an English poem by Walt Whitman. Hölderlin's text stands out, because the mood changes starkly from the first stanza to the second, from Beauty/Joy to Sadness. Trakl's text is a bit more complex with bits of Nostalgia and, most importantly, a mixture of Uneasiness with Awe/Sublime. Whitman's poem is an example of Vitality and its mixing with Sadness. The English annotation was unified by us for space constraints. For the full annotation please see https://github.com/tnhaider/poetry-emotion/",Question 1: What is the mood shift in Friedrich Hölderlin's poem in the German gold standard annotation?,Answer 1: The mood changes starkly from Beauty/Joy to Sadness in the second stanza.
"A special thanks goes to Gesine Fuhrmann, who created the guidelines and tirelessly documented the annotation progress. Also thanks to Annika Palm and Debby Trzeciak who annotated and gave lively feedback. For help with the conceptualization of labels we thank Ines Schindler. This research has been partially conducted within the CRETA center (http://www.creta.uni-stuttgart.de/) which is funded by the German Ministry for Education and Research (BMBF) and partially funded by the German Research Council (DFG), projects SEAT (Structured Multi-Domain Emotion Analysis from Text, KL 2869/1-1). This work has also been supported by the German Research Foundation as part of the Research Training Group Adaptive Preparation of Information from Heterogeneous Sources (AIPHES) at the Technische Universität Darmstadt under grant No. GRK 1994/1.",Question 1: Who is responsible for creating the annotation guidelines and documenting the annotation progress?,Answer 1: Gesine Fuhrmann is responsible for creating the annotation guidelines and documenting the annotation progress.
