context,question,answer
"Our current understanding of engagement patterns in online communities is patched up from glimpses offered by several disparate studies focusing on a few individual communities. This work calls into attention the need for a method to systematically reason about similarities and differences across communities. By proposing a way to structure the multi-community space, we find not only that radically contrasting engagement patterns emerge in different parts of this space, but also that this variation can be at least partly explained by the type of identity each community fosters..Our choice in this work is to structure the multi-community space according to a typology based on community identity, as reflected in language use. We show that this effectively explains cross-community variation of three different user engagement measures—retention, acculturation and content affinity—and complements measures based on activity and size with additional interpretable information. For example, we find that in niche communities established members are more likely to engage with volatile content than outsiders, while the opposite is true in generic communities. Such insights can be useful for community maintainers seeking to understand engagement patterns in their own communities..One main area of future research is to examine the temporal dynamics in the multi-community landscape. By averaging our measures of distinctiveness and dynamicity across time, our present study treated community identity as a static property. However, as communities experience internal changes and respond to external events, we can expect the nature of their identity to shift as well. For instance, the relative consistency of harrypotter may be disrupted by the release of a new novel, while Seahawks may foster different identities during and between football seasons. Conversely, a community's type may also mediate the impact of new events. Moving beyond a static view of community identity could enable us to better understand how temporal phenomena such as linguistic change manifest across different communities, and also provide a more nuanced view of user engagement—for instance, are communities more welcoming to newcomers at certain points in their lifecycle?.Another important avenue of future work is to explore other ways of mapping the landscape of online communities. For example, combining structural properties of communities BIBREF40 with topical information BIBREF35 and with our identity-based measures could further characterize and explain variations in user engagement patterns. Furthermore, extending the present analyses to even more diverse communities supported by different platforms (e.g., GitHub, StackExchange, Wikipedia) could enable the characterization of more complex behavioral patterns such as collaboration and altruism, which become salient in different multicommunity landscapes.",Question 1: What is the main area of future research discussed in the text?,Answer 1: The main area of future research discussed in the text is examining the temporal dynamics in the multi-community landscape and how community identity shifts over time.
"As with monthly retention, we find a strong positive relationship between a community's dynamicity and the average number of months that a user will stay in that community (Spearman's INLINEFORM0 = 0.41, INLINEFORM1 0.001, computed over all community points; Figure FIGREF11 .B, left). This verifies that the short-term trend observed for monthly retention translates into longer-term engagement and suggests that long-term user retention might be strongly driven by the extent to which a community continually provides novel content. Interestingly, there is no significant relationship between distinctiveness and long-term engagement (Spearman's INLINEFORM2 = 0.03, INLINEFORM3 0.77; Figure FIGREF11 .B, right). Thus, while highly distinctive communities like RandomActsOfMakeup may generate focused commitment from users over a short period of time, such communities are unlikely to retain long-term users unless they also have sufficiently dynamic content..To measure user tenures we focused on one slice of data (May, 2013) and measured how many months a user spends in each community, on average—the average number of months between a user's first and last comment in each community. We have activity data up until May 2015, so the maximum tenure is 24 months in this set-up, which is exceptionally long relative to the average community member (throughout our entire data less than INLINEFORM0 of users have tenures of more than 24 months in any community).",What is the relationship between a community's dynamicity and long-term user retention? ,"The text states that there is a strong positive relationship between a community's dynamicity and the average number of months a user stays in that community, suggesting that long-term user retention might be strongly driven by the extent to which a community continually provides novel content."
"We find that dynamic communities, such as Seahawks or starcraft, have substantially higher rates of monthly user retention than more stable communities (Spearman's INLINEFORM0 = 0.70, INLINEFORM1 0.001, computed with community points averaged over months; Figure FIGREF11 .A, left). Similarly, more distinctive communities, like Cooking and Naruto, exhibit moderately higher monthly retention rates than more generic communities (Spearman's INLINEFORM2 = 0.33, INLINEFORM3 0.001; Figure FIGREF11 .A, right)..Monthly retention is formally defined as the proportion of users who contribute in month INLINEFORM0 and then return to contribute again in month INLINEFORM1 . Each monthly datapoint is treated as unique and the trends in Figure FIGREF11 show 95% bootstrapped confidence intervals, cluster-resampled at the level of subreddit BIBREF25 , to account for differences in the number of months each subreddit contributes to the data..Importantly, we find that in the task of predicting community-level user retention our identity-based typology holds additional predictive value on top of strong baseline features based on community-size (# contributing users) and activity levels (mean # contributions per user), which are commonly used for churn prediction BIBREF7 . We compared out-of-sample predictive performance via leave-one-community-out cross validation using random forest regressors with ensembles of size 100, and otherwise default hyperparameters BIBREF26 . A model predicting average monthly retention based on a community's average distinctiveness and dynamicity achieves an average mean squared error ( INLINEFORM0 ) of INLINEFORM1 and INLINEFORM2 , while an analogous model predicting based on a community's size and average activity level (both log-transformed) achieves INLINEFORM4 and INLINEFORM5 . The difference between the two models is not statistically significant ( INLINEFORM6 , Wilcoxon signed-rank test). However, combining features from both models results in a large and statistically significant improvement over each independent model ( INLINEFORM7 , INLINEFORM8 , INLINEFORM9 Bonferroni-corrected pairwise Wilcoxon tests). These results indicate that our typology can explain variance in community-level retention rates, and provides information beyond what is present in standard activity-based features.",What is monthly retention and how does the study suggest that dynamic and distinctive communities influence it?,"Monthly retention is defined as the proportion of users who contribute in one month and then return to contribute again in the next month. The study found that dynamic communities (such as Seahawks or starcraft) with high rates of fluctuation and distinctive communities (like Cooking and Naruto) with unique themes have a higher monthly retention rate compared to stable or generic communities. The study also found that the identity-based typology holds additional predictive value in determining community-level user retention, beyond standard activity-based features commonly used for churn prediction. Combining features from both models results in a statistically significant improvement over each independent model."
"Having described these word-level measures, we now proceed to establish the primary axes of our typology:.Distinctiveness. A community with a very distinctive identity will tend to have distinctive interests, expressed through specialized language. Formally, we define the distinctiveness of a community INLINEFORM0 as the average specificity of all utterances in INLINEFORM1 . We refer to a community with a less distinctive identity as being generic..Dynamicity. A highly dynamic community constantly shifts interests from one time window to another, and these temporal variations are reflected in its use of volatile language. Formally, we define the dynamicity of a community INLINEFORM0 as the average volatility of all utterances in INLINEFORM1 . We refer to a community whose language is relatively consistent throughout time as being stable..In our subsequent analyses, we focus mostly on examing the average distinctiveness and dynamicity of a community over time, denoted INLINEFORM0 and INLINEFORM1 .",What is the definition of the distinctiveness of a community in this typology?,"The distinctiveness of a community is defined as the average specificity of all utterances in the community, and it indicates how unique the community's identity is in terms of their specialized language."
"We have seen that our typology produces qualitatively satisfying groupings of communities according to the nature of their collective identity. This section shows that there is an informative and highly predictive relationship between a community's position in this typology and its user engagement patterns. We find that communities with distinctive and dynamic identities have higher rates of user engagement, and further show that a community's position in our identity-based landscape holds important predictive information that is complementary to a strong activity baseline..In particular user retention is one of the most crucial aspects of engagement and is critical to community maintenance BIBREF2 . We quantify how successful communities are at retaining users in terms of both short and long-term commitment. Our results indicate that rates of user retention vary drastically, yet systematically according to how distinctive and dynamic a community is (Figure FIGREF3 )..We find a strong, explanatory relationship between the temporal consistency of a community's identity and rates of user engagement: dynamic communities that continually update and renew their discussion content tend to have far higher rates of user engagement. The relationship between distinctiveness and engagement is less universal, but still highly informative: niche communities tend to engender strong, focused interest from users at one particular point in time, though this does not necessarily translate into long-term retention.",What is the relationship between a community's position in the typology and its user engagement patterns?,"Answer 1: The text shows that there is a highly predictive relationship between a community's position in the identity-based typology and its user engagement patterns. Communities with distinctive and dynamic identities have higher rates of user engagement, and a community's position in the typology is complementary to a strong activity baseline."
"Through the acculturation gap, we have shown that communities exhibit large yet systematic variations in their permeability to outsiders. We now turn to understanding the divide in commenting behaviour between outsiders and active community members at a finer granularity, by focusing on two particular ways in which such gaps might manifest among users: through different levels of engagement with specific content and with temporally volatile content..Echoing previous results, we find that community type mediates the extent and nature of the divide in content affinity. While in distinctive communities active members have a higher affinity for both community-specific content and for highly volatile content, the opposite is true for generic communities, where it is the outsiders who engage more with volatile content..We quantify these divides in content affinity by measuring differences in the language of the comments written by active users and outsiders. Concretely, for each community INLINEFORM0 , we define the specificity gap INLINEFORM1 as the relative difference between the average specificity of comments authored by active members, and by outsiders, where these measures are macroaveraged over users. Large, positive INLINEFORM2 then occur in communities where active users tend to engage with substantially more community-specific content than outsiders..We analogously define the volatility gap INLINEFORM0 as the relative difference in volatilities of active member and outsider comments. Large, positive values of INLINEFORM1 characterize communities where active users tend to have more volatile interests than outsiders, while negative values indicate communities where active users tend to have more stable interests..We find that in 94% of communities, INLINEFORM0 , indicating (somewhat unsurprisingly) that in almost all communities, active users tend to engage with more community-specific content than outsiders. However, the magnitude of this divide can vary greatly: for instance, in Homebrewing, which is dedicated to brewing beer, the divide is very pronounced ( INLINEFORM1 0.33) compared to funny, a large hub where users share humorous content ( INLINEFORM2 0.011)..The nature of the volatility gap is comparatively more varied. In Homebrewing ( INLINEFORM0 0.16), as in 68% of communities, active users tend to write more volatile comments than outsiders ( INLINEFORM1 0). However, communities like funny ( INLINEFORM2 -0.16), where active users contribute relatively stable comments compared to outsiders ( INLINEFORM3 0), are also well-represented on Reddit..To understand whether these variations manifest systematically across communities, we examine the relationship between divides in content affinity and community type. In particular, following the intuition that active users have a relatively high affinity for a community's niche, we expect that the distinctiveness of a community will be a salient mediator of specificity and volatility gaps. Indeed, we find a strong correlation between a community's distinctiveness and its specificity gap (Spearman's INLINEFORM0 0.34, INLINEFORM1 0.001)..We also find a strong correlation between distinctiveness and community volatility gaps (Spearman's INLINEFORM0 0.53, INLINEFORM1 0.001). In particular, we see that among the most distinctive communities (i.e., the top third of communities by distinctiveness), active users tend to write more volatile comments than outsiders (mean INLINEFORM2 0.098), while across the most generic communities (i.e., the bottom third), active users tend to write more stable comments (mean INLINEFORM3 -0.047, Mann-Whitney U test INLINEFORM4 0.001). The relative affinity of outsiders for volatile content in these communities indicates that temporally ephemeral content might serve as an entry point into such a community, without necessarily engaging users in the long term.",Question 1: What is the relationship between a community's distinctiveness and its specificity and volatility gaps?,"Answer 1: The study found a strong correlation between a community's distinctiveness and its specificity and volatility gaps. Specifically, the more distinctive a community is, the higher the specificity and volatility gaps tend to be, with active members engaging more with community-specific and volatile content compared to outsiders. In contrast, the more generic a community is, the less pronounced the gaps are, with active members tending to write more stable comments compared to outsiders."
"The previous section shows that there is a strong connection between the nature of a community's identity and its basic user engagement patterns. In this section, we probe the relationship between a community's identity and how permeable, or accessible, it is to outsiders..We measure this phenomenon using what we call the acculturation gap, which compares the extent to which engaged vs. non-engaged users employ community-specific language. While previous work has found this gap to be large and predictive of future user engagement in two beer-review communities BIBREF5 , we find that the size of the acculturation gap depends strongly on the nature of a community's identity, with the gap being most pronounced in stable, highly distinctive communities (Figure FIGREF13 )..This finding has important implications for our understanding of online communities. Though many works have analyzed the dynamics of “linguistic belonging” in online communities BIBREF16 , BIBREF28 , BIBREF5 , BIBREF17 , our results suggest that the process of linguistically fitting in is highly contingent on the nature of a community's identity. At one extreme, in generic communities like pics or worldnews there is no distinctive, linguistic identity for users to adopt..To measure the acculturation gap for a community, we follow Danescu-Niculescu-Mizil et al danescu-niculescu-mizilno2013 and build “snapshot language models” (SLMs) for each community, which capture the linguistic state of a community at one point of time. Using these language models we can capture how linguistically close a particular utterance is to the community by measuring the cross-entropy of this utterance relative to the SLM: DISPLAYFORM0 .where INLINEFORM0 is the probability assigned to bigram INLINEFORM1 from comment INLINEFORM2 in community-month INLINEFORM3 . We build the SLMs by randomly sampling 200 active users—defined as users with at least 5 comments in the respective community and month. For each of these 200 active users we select 5 random 10-word spans from 5 unique comments. To ensure robustness and maximize data efficiency, we construct 100 SLMs for each community-month pair that has enough data, bootstrap-resampling from the set of active users..We compute a basic measure of the acculturation gap for a community-month INLINEFORM0 as the relative difference of the cross-entropy of comments by users active in INLINEFORM1 with that of singleton comments by outsiders—i.e., users who only ever commented once in INLINEFORM2 , but who are still active in Reddit in general: DISPLAYFORM0 . INLINEFORM0 denotes the distribution over singleton comments, INLINEFORM1 denotes the distribution over comments from users active in INLINEFORM2 , and INLINEFORM3 the expected values of the cross-entropy over these respective distributions. For each bootstrap-sampled SLM we compute the cross-entropy of 50 comments by active users (10 comments from 5 randomly sampled active users, who were not used to construct the SLM) and 50 comments from randomly-sampled outsiders..Figure FIGREF13 .A shows that the acculturation gap varies substantially with how distinctive and dynamic a community is. Highly distinctive communities have far higher acculturation gaps, while dynamicity exhibits a non-linear relationship: relatively stable communities have a higher linguistic `entry barrier', as do very dynamic ones. Thus, in communities like IAmA (a general Q&A forum) that are very generic, with content that is highly, but not extremely dynamic, outsiders are at no disadvantage in matching the community's language. In contrast, the acculturation gap is large in stable, distinctive communities like Cooking that have consistent community-specific language. The gap is also large in extremely dynamic communities like Seahawks, which perhaps require more attention or interest on the part of active users to keep up-to-date with recent trends in content..These results show that phenomena like the acculturation gap, which were previously observed in individual communities BIBREF28 , BIBREF5 , cannot be easily generalized to a larger, heterogeneous set of communities. At the same time, we see that structuring the space of possible communities enables us to observe systematic patterns in how such phenomena vary.",What is the acculturation gap and how is it measured in this study?,"The acculturation gap is a measure of the extent to which engaged users in a community use community-specific language compared to non-engaged users. It is measured in this study through the construction of ""snapshot language models"" for each community and calculating the cross-entropy of comments from active users relative to singleton comments from outsiders. The size of the acculturation gap depends on the nature of a community's identity, with highly distinctive and stable communities having a larger gap."
